[
  {
    "key": "request.created",
    "source_module": "request",
    "tenant_id": "demo-cleaning-company",
    "linked_object_type": "request",
    "linked_object_id": "req-5551",
    "correlation_id": "corr-req-5551",
    "payload": {
      "source": "customer_portal"
    },
    "is_test_data": true,
    "test_batch_id": "request-crm-shell-001",
    "created_at": "2026-06-11T10:00:00+02:00"
  },
  {
    "key": "request.customer_message_received",
    "source_module": "request",
    "tenant_id": "demo-cleaning-company",
    "linked_object_type": "request",
    "linked_object_id": "req-5551",
    "correlation_id": "corr-req-5551",
    "payload": {
      "thread_id": "thread-customer-1",
      "message_id": "msg-1"
    },
    "is_test_data": true,
    "test_batch_id": "request-crm-shell-001",
    "created_at": "2026-06-11T10:02:00+02:00"
  },
  {
    "key": "internal_task.comment_created",
    "source_module": "request",
    "tenant_id": "demo-cleaning-company",
    "linked_object_type": "internal_post",
    "linked_object_id": "post-1",
    "correlation_id": "corr-task-post-1",
    "payload": {
      "request_id": "req-5552",
      "assignees": [
        "admin-marcus",
        "admin-sebastian"
      ]
    },
    "is_test_data": true,
    "test_batch_id": "request-crm-shell-001",
    "created_at": "2026-06-11T10:10:00+02:00"
  },
  {
    "key": "chat.ai_unable_to_resolve",
    "source_module": "chat",
    "tenant_id": "demo-cleaning-company",
    "linked_object_type": "chat_session",
    "linked_object_id": "chat-1",
    "correlation_id": "corr-chat-1",
    "payload": {
      "ai_mode": "mock",
      "reason": "rescheduling requires availability check"
    },
    "is_test_data": true,
    "test_batch_id": "request-crm-shell-001",
    "created_at": "2026-06-11T10:12:00+02:00"
  },
  {
    "key": "email.delivery_failed",
    "source_module": "request",
    "tenant_id": "demo-cleaning-company",
    "linked_object_type": "email_outbox_job",
    "linked_object_id": "email-job-1",
    "correlation_id": "corr-email-1",
    "payload": {
      "request_id": "req-5551",
      "attempts": 3
    },
    "is_test_data": true,
    "test_batch_id": "request-crm-shell-001",
    "created_at": "2026-06-11T10:13:00+02:00"
  }
]
